{
  "$schema": "schemas/interop-service.schema.json",
  "$comment": [
    "Bead's interop service: the procedures every implementation's interop server offers alike, so a client of one calls a server of another, and the conversations of conversations.json play against any of them.",
    "Payloads are JSON, read and written as spec section 17 states: in UTF-8, in canonical form. A payload that does not read is answered with PAYLOAD_UNDECODABLE.",
    "answers says what a procedure answers; admits, what its admission lets through, when it has one.",
    "procedures: each procedure of interop-blueprint.json, by its name and in its order, as its server plays it. Its id, its kind, its admission and its failures are the blueprint's, a blueprint of the builder's (decision 0022).",
    "notifies: what a notification procedure notifies its subscribers.",
    "relay: what the interop server's relay admits, what it forwards, and whether it verifies what it forwards. Its destinations are its clients' connections, each registered by register, with the audience it verifies or with none, and taken out by unregister.",
    "credentials: what the interop server resolves a request's credential with, by its scheme. elsewhere is its ELSEWHERE verifier: what it reads, the grammar of the values it holds, in ABNF (RFC 5234, where a string is case-insensitive, and RFC 7405, where %s makes one case-sensitive), and what it settles with.",
    "credentials.jwt: what the interop server verifies a JWT with (sections 13.8, 13.9), its clients given its keys and its audience alike, for the commands they receive. keys are two issuers' published test keys, each a JWK with its issuer and its one algorithm, whose private halves anyone can read: no configuration outside spec/, the tests and the interop service names one. audience is the audience the server verifies. keySet is the key set the server is given besides: issuers, the issuers it answers for, which the server is given with it, each with the keys it answers, published test keys, and what it answers, on the server's clock; maximumWaitingCalls, the most calls that wait for one issuer's deadline at once, which the server is given with it, small so that a conversation passes it; answers, what it does asked for any other.",
    "verifiers: what both sides' interop tests hold the interop service's own readers to, read from here. elsewhere, each value its ELSEWHERE verifier is given, as its transport carried it, and its verdict: holds, with the sub its session takes as its id and in its data, and its end when it has one; none; or rejects, with its rejection; at once, or once after milliseconds passed on its server's clock. endSessionsOf, the requests it takes, each with the issuer it reads, and those it refuses, each by throwing its refusal."
  ],
  "specVersion": "0.9.0",
  "relay": {
    "admits": "requireCredential, a server's relay's admission by default: a call whose header presents a JWT, or an ELSEWHERE its transport carried, read from its credential scheme alone; any other, one that presents none or OPAQUE, is refused with ACCESS_DENIED, detail \"a relay admits by default only a credential it forwards\", in leg A's connection's session or in none. Before it, a scheme to come is refused with CREDENTIAL_UNSUPPORTED, detail \"OPAQUE, JWT, ELSEWHERE\", and an OPAQUE that does not hold, or an ELSEWHERE whose transport carried nothing, with SESSION_REQUIRED (section 14.3, step 1). A conversation's relay may give shareLegBSession in its place, which admits besides a call in any session of leg A's connection's, whatever its destination, and refuses a call in none that presented none with SESSION_REQUIRED, or requireSession, which tests the call's session, and so refuses every credential the relay forwards without verifying with ACCESS_DENIED, and a call in none that presented none with SESSION_REQUIRED (section 13.5)",
    "forwards": "what leg A presents, as section 14.2's table says: none for none or OPAQUE; a JWT, its same bytes, to a destination registered with the audience its aud names; an ELSEWHERE, the credential its transport carried moved to leg B's transport as it came, to a destination registered with an audience, over a connection whose transport carries one. A JWT or an ELSEWHERE it cannot so forward — to a destination of another audience or of none, over a connection that carries no credential, or in the clear off the machine — is refused with DESTINATION_UNREACHABLE (section 14.3, step 5)",
    "verifies": "nothing, unless a conversation's relay says it verifies: then it verifies a JWT with the server's credentials against the audiences its destinations were registered with, and an ELSEWHERE with the server's ELSEWHERE verifier, before its admission, which then reads the credential's session (section 14.3, step 1)"
  },
  "procedures": [
    {
      "procedureName": "echo",
      "request": "any JSON value",
      "answers": "its request's payload, the same value"
    },
    {
      "procedureName": "fail",
      "request": "any JSON value",
      "answers": "an application failure: code 7, detail \"this procedure fails, on purpose\""
    },
    {
      "procedureName": "slow",
      "request": "{\"milliseconds\":n}",
      "answers": "n, once n milliseconds passed; cancelled first, it counts one cancellation for its connection, then answers n all the same, an answer that must not go out"
    },
    {
      "procedureName": "cancellations",
      "request": "any JSON value",
      "answers": "how many calls to slow its connection cancelled so far, a number"
    },
    {
      "procedureName": "denied",
      "request": "any JSON value",
      "admits": "nobody: every request is refused with ACCESS_DENIED, detail \"this procedure admits nobody\"",
      "answers": "null, never reached"
    },
    {
      "procedureName": "broken",
      "request": "any JSON value",
      "answers": "nothing: it throws \"this procedure breaks, on purpose\" before it answers, which its server answers with PROCEDURE_FAILED and reports"
    },
    {
      "procedureName": "bytes",
      "request": "{\"length\":n}",
      "answers": "a string of n letters x"
    },
    {
      "procedureName": "ask",
      "request": "any JSON value",
      "answers": "what its client's clock answers, asked \"What time is it where you are?\" within 10 s; a clock that fails fails it, answered with PROCEDURE_FAILED"
    },
    {
      "procedureName": "clock",
      "request": "a JSON string, the question",
      "answers": "\"noon\""
    },
    {
      "procedureName": "ticks",
      "notifies": "each value tick notifies, as a JSON number, to the subscription its call's session holds on its connection, one per session (section 11.3)",
      "request": "{\"hold\":n}, {\"hold\":n,\"fail\":true}, or any other JSON value",
      "answers": "null: at once; or, held, once n ticks of its call's session on its connection notified, having subscribed its requester before it waits; held and failing, an application failure there instead: code 7, detail \"this procedure fails, on purpose\""
    },
    {
      "procedureName": "tick",
      "request": "{\"value\":v} or {\"value\":v,\"key\":k}",
      "answers": "null, once it notified v to the subscription to ticks its call's session holds on its connection — keyed by k when given — and the ticks of that session it held have answered"
    },
    {
      "procedureName": "login",
      "request": "{\"name\":s}, with \"sessionTimeout\":t, \"connectionTimeout\":c, or both, in milliseconds",
      "answers": "s, once it opened a new session for its connection, whatever its call presents, s its data, its session timeout t and its connection timeout c, each held as section 1.4 holds a duration and without end when not given (section 13.7); a t or c under a millisecond or past 2³¹ − 1, as given, opens no session and fails it, which its server answers with PROCEDURE_FAILED and reports"
    },
    {
      "procedureName": "logout",
      "request": "any JSON value",
      "admits": "a call in its connection's session; one in a credential's session is refused with ACCESS_DENIED, detail \"a call in a credential's session ends no connection's session\", since SESSION_REQUIRED would have its client withdraw a credential that holds, and one in none with SESSION_REQUIRED",
      "answers": "null, once it ended its connection's session"
    },
    {
      "procedureName": "whoami",
      "request": "any JSON value",
      "admits": "a call with a session, its call's; one in none is refused with SESSION_REQUIRED",
      "answers": "the name its call's session holds: the name login gave its connection's session, or the sub of its credential's claims, or of what its ELSEWHERE verifier gave"
    },
    {
      "procedureName": "register",
      "request": "{\"destination\":n}, with \"audience\":a, \"timeout\":t, or both",
      "answers": "n, once it registered its caller's connection as the destination n, with the audience a, which that destination verifies, when given, and with none otherwise (section 14.1), leg B waiting t milliseconds at most for its answer when given, t held as section 1.4 holds a duration; a t under a millisecond or past 2³¹ − 1, as given, registers nothing and fails it, which its server answers with PROCEDURE_FAILED and reports; a destination registered already whose connection is open, or that is no connection of the server's, fails it, an application failure: code 8, detail \"that destination is registered already\", and one whose connection closed it registers anew, in its place at once (section 14.1). It checks nobody: any connection registers any destination, as section 14.1 leaves it to the application"
    },
    {
      "procedureName": "unregister",
      "request": "any JSON value",
      "answers": "true, once it took out the destination its caller's connection registered last; false when there is none, or another connection registered it anew since"
    },
    {